{
 "id": "ves03wastelandadventurer",
 "speaker_name": "Wasteland adventurer",
 "source": "VES03WastelandAdventurer.txt",
 "topics": [
  {
   "key": "greeting",
   "section": "topics",
   "responses": [
    {
     "text": "Peace, traveler.",
     "emotion": "neutral",
     "intensity": 50
    },
    {
     "text": "You again? What 'cha need, champ?",
     "emotion": "neutral",
     "intensity": 50
    }
   ],
   "topic": "GREETING",
   "prompt": "GREETING"
  },
  {
   "key": "ves03dialoguewastelandhuntergsves03wastelandadventurertopic000",
   "section": "topics",
   "responses": [
    {
     "text": "Sign says you go south... just look for the rollercoaster. Oh and don't go north, a caravan just got sacked up the road.",
     "emotion": "neutral",
     "intensity": 50
    }
   ],
   "topic": "VES03DialogueWastelandHunterGSVES03WastelandAdventurerTopic000",
   "prompt": "Which way to Primm?"
  },
  {
   "key": "ves03dialoguewastelandhuntergsves03wastelandadventurertopic001",
   "section": "topics",
   "responses": [
    {
     "text": "Just a hunter, out here killing things and hoping their hides fetch more than the bullets cost to kill 'em.",
     "emotion": "neutral",
     "intensity": 50
    }
   ],
   "topic": "VES03DialogueWastelandHunterGSVES03WastelandAdventurerTopic001",
   "prompt": "Who are you?"
  },
  {
   "key": "ves03dialoguewastelandhuntergsves03wastelandadventurertopic002",
   "section": "topics",
   "responses": [
    {
     "text": "Watch your back out there.",
     "emotion": "neutral",
     "intensity": 50
    },
    {
     "text": "Whatever.",
     "emotion": "neutral",
     "intensity": 50
    },
    {
     "text": "Keep your guns loaded and ready.",
     "emotion": "neutral",
     "intensity": 50
    }
   ],
   "topic": "VES03DialogueWastelandHunterGSVES03WastelandAdventurerTopic002",
   "prompt": "Goodbye."
  },
  {
   "key": "ves03dialoguewastelandhuntergsves03wastelandadventurertopic003",
   "section": "topics",
   "responses": [
    {
     "text": "I could use some Stimpaks... how 'bout some nice Bloatfly Steaks in trade?",
     "emotion": "neutral",
     "intensity": 50
    }
   ],
   "topic": "VES03DialogueWastelandHunterGSVES03WastelandAdventurerTopic003",
   "prompt": "Let's trade."
  },
  {
   "key": "ves03dialoguewastelandhuntergsves03wastelandadventurertopic004",
   "section": "topics",
   "responses": [
    {
     "text": "That's a dangerous question... asked the way a bandit might ask... but since we're close to town I'll trust your good intentions.",
     "emotion": "neutral",
     "intensity": 50
    }
   ],
   "topic": "VES03DialogueWastelandHunterGSVES03WastelandAdventurerTopic004",
   "prompt": "Do you have anything to trade?"
  },
  {
   "key": "ves03dialoguewastelandhuntergsves03wastelandadventurertopic009",
   "section": "topics",
   "responses": [
    {
     "text": "It just gets worse the further north you go... Deathclaws... death in general. But it's your ass, I suppose.",
     "emotion": "neutral",
     "intensity": 50
    }
   ],
   "topic": "VES03DialogueWastelandHunterGSVES03WastelandAdventurerTopic009",
   "prompt": "What if I go around the caravan?"
  }
 ],
 "speaker": "wasteland_adventurer"
}
