{
 "id": "vfsfisto",
 "speaker_name": "Fisto",
 "source": "VFSFisto.txt",
 "topics": [
  {
   "key": "greeting",
   "section": "topics",
   "responses": [
    {
     "text": "Fully Integrated Security Technetronic Officer active and reporting for duty.",
     "emotion": "neutral",
     "intensity": 50
    },
    {
     "text": "Operation complete. Thank you for your business.",
     "emotion": "neutral",
     "intensity": 50
    },
    {
     "text": "Greetings. Fisto is programmed to please.",
     "emotion": "neutral",
     "intensity": 50
    },
    {
     "text": "I am programmed for your pleasure. Please assume the position.",
     "emotion": "neutral",
     "intensity": 50
    }
   ],
   "topic": "GREETING",
   "prompt": "GREETING"
  },
  {
   "key": "vfreeformfreesidevfsfistotopic000",
   "section": "topics",
   "responses": [
    {
     "text": "Yes, sir. Fisto reporting for duty.",
     "emotion": "neutral",
     "intensity": 50
    },
    {
     "text": "Please assume the position.",
     "emotion": "neutral",
     "intensity": 50
    },
    {
     "text": "Yes, ma'am. Fisto reporting for duty.",
     "emotion": "neutral",
     "intensity": 50
    },
    {
     "text": "Please assume the position.",
     "emotion": "neutral",
     "intensity": 50
    }
   ],
   "topic": "VFreeformFreesideVFSFistoTopic000",
   "prompt": "That is a mouthful. Let's shorten that to Fisto."
  },
  {
   "key": "vfreeformfreesidevfsfistotopic001",
   "section": "topics",
   "responses": [
    {
     "text": "I am programmed for your pleasure. Please assume the position.",
     "emotion": "neutral",
     "intensity": 50
    }
   ],
   "topic": "VFreeformFreesideVFSFistoTopic001",
   "prompt": "What?! No!"
  },
  {
   "key": "vfreeformfreesidevfsfistotopic002",
   "section": "topics",
   "responses": [
    {
     "text": "Fisto will report to the Atomic Wrangler for further orders.",
     "emotion": "neutral",
     "intensity": 50
    }
   ],
   "topic": "VFreeformFreesideVFSFistoTopic002",
   "prompt": "My pleasure is for you to work at the Atomic Wrangler."
  },
  {
   "key": "vfreeformfreesidevfsfistotopic003",
   "section": "topics",
   "responses": [
    {
     "text": "Servos active!",
     "emotion": "neutral",
     "intensity": 50
    }
   ],
   "topic": "VFreeformFreesideVFSFistoTopic003",
   "prompt": "I suppose I should test you out before I hand you to the Garrets..."
  },
  {
   "key": "vfreeformfreesidevfsfistotopic004",
   "section": "topics",
   "responses": [
    {
     "text": "Yes, sir!",
     "emotion": "neutral",
     "intensity": 50
    },
    {
     "text": "Yes, ma'am!",
     "emotion": "neutral",
     "intensity": 50
    }
   ],
   "topic": "VFreeformFreesideVFSFistoTopic004",
   "prompt": "Report to the Atomic Wrangler. James Garret is your new owner."
  },
  {
   "key": "vfreeformfreesidevfsfistotopic005",
   "section": "topics",
   "responses": [
    {
     "text": "Are you uncomfortable? My servos may require adjustment.",
     "emotion": "neutral",
     "intensity": 50
    }
   ],
   "topic": "VFreeformFreesideVFSFistoTopic005",
   "prompt": "Well, that was... different."
  },
  {
   "key": "vfreeformfreesidevfsfistotopic006",
   "section": "topics",
   "responses": [
    {
     "text": "I will require a hardware and software upgrade to offer enhanced services.",
     "emotion": "neutral",
     "intensity": 50
    }
   ],
   "topic": "VFreeformFreesideVFSFistoTopic006",
   "prompt": "That all you've got, robot?"
  },
  {
   "key": "vfreeformfreesidevfsfistotopic008",
   "section": "topics",
   "responses": [
    {
     "text": "Excellent. Awaiting further orders.",
     "emotion": "neutral",
     "intensity": 50
    }
   ],
   "topic": "VFreeformFreesideVFSFistoTopic008",
   "prompt": "No, you performed as intended."
  },
  {
   "key": "vfreeformfreesidevfsfistotopic010",
   "section": "topics",
   "responses": [
    {
     "text": "Numbness will subside in several minutes. Awaiting further orders.",
     "emotion": "neutral",
     "intensity": 50
    }
   ],
   "topic": "VFreeformFreesideVFSFistoTopic010",
   "prompt": "I can't feel my legs!"
  },
  {
   "key": "vfreeformfreesidevfsfistotopic011",
   "section": "topics",
   "responses": [
    {
     "text": "That will be 10 caps, please.",
     "emotion": "neutral",
     "intensity": 50
    },
    {
     "text": "I am sorry, but you must procure a room first. Please return when you have lodging arranged.",
     "emotion": "neutral",
     "intensity": 50
    }
   ],
   "topic": "VFreeformFreesideVFSFistoTopic011",
   "prompt": "I would like to purchase your services."
  },
  {
   "key": "vfreeformfreesidevfsfistotopic012",
   "section": "topics",
   "responses": [
    {
     "text": "Thank you. I will meet you in your room.",
     "emotion": "neutral",
     "intensity": 50
    }
   ],
   "topic": "VFreeformFreesideVFSFistoTopic012",
   "prompt": "<Pay 10 caps>"
  },
  {
   "key": "vfreeformfreesidevfsfistotopic014",
   "section": "topics",
   "responses": [
    {
     "text": "Servos active!",
     "emotion": "neutral",
     "intensity": 50
    }
   ],
   "topic": "VFreeformFreesideVFSFistoTopic014",
   "prompt": "Woohoo! <assume the position>"
  },
  {
   "key": "vfreeformfreesidevfsfistotopic015",
   "section": "topics",
   "responses": [
    {
     "text": "Very well. Please return if you require further service.",
     "emotion": "neutral",
     "intensity": 50
    }
   ],
   "topic": "VFreeformFreesideVFSFistoTopic015",
   "prompt": "Never mind, I would like a refund."
  },
  {
   "key": "vfsfistobusy",
   "section": "conversation",
   "responses": [
    {
     "text": "Routine active. Please return later.",
     "emotion": "neutral",
     "intensity": 50
    }
   ],
   "topic": "VFSFistoBusy",
   "prompt": "VFSFistoBusy"
  },
  {
   "key": "vfsfistokiller",
   "section": "conversation",
   "responses": [
    {
     "text": "Exterminate!",
     "emotion": "neutral",
     "intensity": 50
    }
   ],
   "topic": "VFSFistoKiller",
   "prompt": "VFSFistoKiller"
  }
 ],
 "speaker": "fisto"
}
