{
 "id": "nellislindsay",
 "speaker_name": "Lindsay",
 "source": "NellisLindsay.txt",
 "topics": [
  {
   "key": "greeting",
   "section": "topics",
   "responses": [
    {
     "text": "Hey there lady! Can you help me find Mister Cuddles?",
     "emotion": "neutral",
     "intensity": 50
    },
    {
     "text": "Hey there mister! Can you help me find Mister Cuddles?",
     "emotion": "neutral",
     "intensity": 50
    },
    {
     "text": "Hi again! Have you found Mister Cuddles?",
     "emotion": "neutral",
     "intensity": 50
    },
    {
     "text": "Thanks again for finding Mister Cuddles! You're the best!",
     "emotion": "neutral",
     "intensity": 50
    },
    {
     "text": "I can't believe Mister Cuddles is gone.",
     "emotion": "neutral",
     "intensity": 50
    }
   ],
   "topic": "GREETING",
   "prompt": "GREETING"
  },
  {
   "key": "vfreeformnellisnellisboomerkid09topic000",
   "section": "topics",
   "responses": [
    {
     "text": "Mister Cuddles is my teddy. I lost him and I don't remember where.",
     "emotion": "neutral",
     "intensity": 50
    }
   ],
   "topic": "VFreeformNellisNellisBoomerKid09Topic000",
   "prompt": "Who is Mister Cuddles?"
  },
  {
   "key": "vfreeformnellisnellisboomerkid09topic001",
   "section": "topics",
   "responses": [
    {
     "text": "Oh. Bye then.",
     "emotion": "neutral",
     "intensity": 50
    }
   ],
   "topic": "VFreeformNellisNellisBoomerKid09Topic001",
   "prompt": "Sorry, I don't have time right now."
  },
  {
   "key": "vfreeformnellisnellisboomerkid09topic002",
   "section": "topics",
   "responses": [
    {
     "text": "Thanks! Let me know when you find him.",
     "emotion": "neutral",
     "intensity": 50
    }
   ],
   "topic": "VFreeformNellisNellisBoomerKid09Topic002",
   "prompt": "Ok, I'll look for him."
  },
  {
   "key": "vfreeformnellisnellisboomerkid09topic003",
   "section": "topics",
   "responses": [
    {
     "text": "Oh, I remember now! I was playing hide and seek in the big hangar! Mister Loyal made us leave though.",
     "emotion": "neutral",
     "intensity": 50
    }
   ],
   "topic": "VFreeformNellisNellisBoomerKid09Topic003",
   "prompt": "Think really hard. What were you doing when you saw him last?"
  },
  {
   "key": "vfreeformnellisnellisboomerkid09topic005",
   "section": "topics",
   "responses": [
    {
     "text": "Thanks! Let me know when you find him.",
     "emotion": "neutral",
     "intensity": 50
    }
   ],
   "topic": "VFreeformNellisNellisBoomerKid09Topic005",
   "prompt": "Great work Lindsay! I'll go take a look for him."
  },
  {
   "key": "vfreeformnellisnellislindsaytopic000",
   "section": "topics",
   "responses": [
    {
     "text": "[SUCCEEDED] Oh, I remember now! I was playing hide and seek in the big hangar! Mister Loyal made us leave though.",
     "emotion": "neutral",
     "intensity": 50
    }
   ],
   "topic": "VFreeformNellisNellisLindsayTopic000",
   "prompt": "Take a deep breath and focus, Lindsay. Where were you with him last?",
   "label": "<Speech>"
  },
  {
   "key": "vfreeformnellisnellislindsaytopic000_2",
   "section": "topics",
   "responses": [
    {
     "text": "[FAILED] I don't know. I play all over. I'll never find him!",
     "emotion": "neutral",
     "intensity": 50
    }
   ],
   "topic": "VFreeformNellisNellisLindsayTopic000",
   "prompt": "Any idea where I should start looking, kid?",
   "label": "<Speech>"
  },
  {
   "key": "vfreeformnellisnellislindsaytopic002",
   "section": "topics",
   "responses": [
    {
     "text": "Oh! Thank you so much! I'll never lose you again Mister Cuddles!",
     "emotion": "neutral",
     "intensity": 50
    }
   ],
   "topic": "VFreeformNellisNellisLindsayTopic002",
   "prompt": "I have Mister Cuddles right here."
  },
  {
   "key": "vfreeformnellisnellislindsaytopic003",
   "section": "topics",
   "responses": [
    {
     "text": "[SUCCEEDED] No! Not Mister Cuddles!",
     "emotion": "disgust",
     "intensity": 50
    },
    {
     "text": "[FAILED] I know you're kidding. Mister Cuddles is just hiding somewhere.",
     "emotion": "pained",
     "intensity": 50
    }
   ],
   "topic": "VFreeformNellisNellisLindsayTopic003",
   "prompt": "<Lie> I'm sorry Lindsay. Mister Cuddles is dead."
  },
  {
   "key": "vfreeformnellisnellislindsaytopic003_2",
   "section": "topics",
   "responses": [
    {
     "text": "[SUCCEEDED] No! Not Mister Cuddles! He can't be dead!",
     "emotion": "fear",
     "intensity": 50
    }
   ],
   "topic": "VFreeformNellisNellisLindsayTopic003",
   "prompt": "<Lie> I already told you he's dead. Get over it already, kid."
  },
  {
   "key": "vfreeformnellisnellislindsaytopic004",
   "section": "topics",
   "responses": [
    {
     "text": "Okay, well thanks for looking. Let me know when you find him.",
     "emotion": "neutral",
     "intensity": 50
    }
   ],
   "topic": "VFreeformNellisNellisLindsayTopic004",
   "prompt": "No, I haven't found him yet."
  }
 ],
 "speaker": "lindsay"
}
