{
 "id": "vhdkhanleader",
 "speaker_name": "Great Khan warrior",
 "source": "VHDKhanLeader.txt",
 "topics": [
  {
   "key": "greeting",
   "section": "topics",
   "responses": [
    {
     "text": "Greetings, courier. We caught word the battle was about to begin. We arrived before the road was closed off; our warriors are here to assist you.",
     "emotion": "neutral",
     "intensity": 50
    }
   ],
   "topic": "GREETING",
   "prompt": "GREETING"
  }
 ],
 "speaker": "great_khan_warrior"
}
