{
 "id": "1eromanowski",
 "speaker_name": "Romanowski",
 "source": "1ERomanowski.txt",
 "topics": [
  {
   "key": "greeting",
   "section": "topics",
   "responses": [
    {
     "text": "What is it, trooper? You're not assigned to my squad, as far as I know.",
     "emotion": "neutral",
     "intensity": 50
    },
    {
     "text": "I'm not a recruitment officer. If you want to join the army, I'm sure someone at McCarran can point you in the right direction.",
     "emotion": "neutral",
     "intensity": 50
    },
    {
     "text": "What is it?",
     "emotion": "neutral",
     "intensity": 50
    }
   ],
   "topic": "GREETING",
   "prompt": "GREETING"
  },
  {
   "key": "vdialoguesharecropper1eromanowskitopic000",
   "section": "topics",
   "responses": [
    {
     "text": "Carry on.",
     "emotion": "neutral",
     "intensity": 50
    }
   ],
   "topic": "vDialogueSharecropper1ERomanowskiTopic000",
   "prompt": "Goodbye."
  },
  {
   "key": "vdialoguesharecropper1eromanowskitopic001",
   "section": "topics",
   "responses": [
    {
     "text": "A lot of the crops grown here support the various NCR camps in the region - McCarran, Golf, and Forlorn Hope, to name a few.",
     "emotion": "neutral",
     "intensity": 50
    },
    {
     "text": "We can't have wastelanders popping in here for a free meal, so my squad and I are assigned to keep things from going to hell.",
     "emotion": "neutral",
     "intensity": 50
    }
   ],
   "topic": "vDialogueSharecropper1ERomanowskiTopic001",
   "prompt": "Why are these fields being guarded?"
  },
  {
   "key": "vdialoguesharecropper1eromanowskitopic002",
   "section": "topics",
   "responses": [
    {
     "text": "Impressive, aren't they? You don't see anything like this outside of NCR territory, that's for sure.",
     "emotion": "happy",
     "intensity": 25
    },
    {
     "text": "We get the water - clean water - pumped in from Lake Mead. If you follow the big pipes, they'll take you all the way to the Lake.",
     "emotion": "neutral",
     "intensity": 50
    }
   ],
   "topic": "vDialogueSharecropper1ERomanowskiTopic002",
   "prompt": "What can you tell me about these fields?"
  },
  {
   "key": "vdialoguesharecropper1eromanowskitopic003",
   "section": "topics",
   "responses": [
    {
     "text": "The Office of Science and Industry has carefully calculated the amount of water needed for these crops. The whole thing is handled by computer.",
     "emotion": "neutral",
     "intensity": 50
    },
    {
     "text": "Besides, most of these crops look fine to me. If the farmers can't handle the job, they shouldn't have signed up in the first place.",
     "emotion": "neutral",
     "intensity": 50
    },
    {
     "text": "If there really is a problem, they can take it up with Lieutenant Boyd at McCarran. Farming isn't my department.",
     "emotion": "neutral",
     "intensity": 50
    }
   ],
   "topic": "vDialogueSharecropper1ERomanowskiTopic003",
   "prompt": "Trent Bascom says he's not getting his full allotment of water."
  },
  {
   "key": "vdialoguesharecropper1eromanowskitopic004",
   "section": "topics",
   "responses": [
    {
     "text": "Corporal White is currently solving the mystery of the {sarcasm} Great Water Shortage. Tried to convince me he had proof, even. I didn't buy any of it.",
     "emotion": "anger",
     "intensity": 5
    },
    {
     "text": "He went over to Westside to talk to Tom Anderson. Anderson's a Follower of the Apocalypse. Helps the people in Westside grow crops or something.",
     "emotion": "neutral",
     "intensity": 50
    }
   ],
   "topic": "vDialogueSharecropper1ERomanowskiTopic004",
   "prompt": "I'm looking for Corporal White. Trent told me you'd seen him."
  },
  {
   "key": "vdialoguesharecropper1eromanowskitopic005",
   "section": "topics",
   "responses": [
    {
     "text": "Haven't seen him. Serves him right if the NCR declares him AWOL.",
     "emotion": "disgust",
     "intensity": 10
    }
   ],
   "topic": "vDialogueSharecropper1ERomanowskiTopic005",
   "prompt": "You haven't heard anything more from White?"
  },
  {
   "key": "vdialoguesharecropper1eromanowskitopic006",
   "section": "topics",
   "responses": [
    {
     "text": "He's a glory hound, always looking for a way to get promoted to Ranger. Thinks he's too good to be a regular trooper like the rest of us.",
     "emotion": "anger",
     "intensity": 10
    }
   ],
   "topic": "vDialogueSharecropper1ERomanowskiTopic006",
   "prompt": "Do you have something against White?"
  },
  {
   "key": "vdialoguesharecropper1eromanowskitopic007",
   "section": "topics",
   "responses": [
    {
     "text": "Yes, please do.",
     "emotion": "disgust",
     "intensity": 50
    }
   ],
   "topic": "vDialogueSharecropper1ERomanowskiTopic007",
   "prompt": "Let's talk about something else."
  },
  {
   "key": "vdialoguesharecropper1eromanowskitopic008",
   "section": "topics",
   "responses": [
    {
     "text": "{doesn't get it} I... really don't see the connection. {trying to save face} Look, I'm a soldier, not a scientist. I just do my job.",
     "emotion": "anger",
     "intensity": 5
    }
   ],
   "topic": "vDialogueSharecropper1ERomanowskiTopic008",
   "prompt": "Crops in Westside - the apparent water shortage here can't be a coincidence, then."
  },
  {
   "key": "vdialoguesharecropper1eromanowskitopic009",
   "section": "topics",
   "responses": [
    {
     "text": "That's... great? So there was a problem, after all. Huh. {making excuses} Well, I'm not a scientist, so it's not my fault if I didn't see anything wrong.",
     "emotion": "anger",
     "intensity": 5
    }
   ],
   "topic": "vDialogueSharecropper1ERomanowskiTopic009",
   "prompt": "The fields should be getting their full supply of water again."
  },
  {
   "key": "vdialoguesharecropper1eromanowskitopic010",
   "section": "topics",
   "responses": [
    {
     "text": "They're based out of the old fort in Freeside. They supposedly helped the NCR out at some point, but they go their own way now.",
     "emotion": "neutral",
     "intensity": 50
    },
    {
     "text": "They know stuff about tech and medicine and usually help out anybody who asks. Can't say I know any more than that.",
     "emotion": "neutral",
     "intensity": 50
    }
   ],
   "topic": "vDialogueSharecropper1ERomanowskiTopic010",
   "prompt": "What can you tell me about the Followers of the Apocalypse?"
  },
  {
   "key": "vdialoguesharecropper1eromanowskitopic011",
   "section": "topics",
   "responses": [
    {
     "text": "They're based out of the old fort in Freeside. They supposedly helped the NCR out at some point, but they go their own way now.",
     "emotion": "neutral",
     "intensity": 50
    },
    {
     "text": "They know stuff about tech and medicine and usually help out anybody who asks. Can't say I know any more than that.",
     "emotion": "neutral",
     "intensity": 50
    }
   ],
   "topic": "vDialogueSharecropper1ERomanowskiTopic011",
   "prompt": "What do you know about the Followers of the Apocalypse?"
  }
 ],
 "speaker": "lieutenant_romanowski"
}
