{
 "id": "ncrcfmeyers",
 "speaker_name": "Meyers",
 "source": "NCRCFMeyers.txt",
 "topics": [
  {
   "key": "greeting",
   "section": "topics",
   "responses": [
    {
     "text": "{Waiting in Primm for Pardon} Have you gotten my pardon from the NCR yet?",
     "emotion": "neutral",
     "intensity": 50
    },
    {
     "text": "{Sheriff of Primm} Thanks for getting me that pardon. Me and the boys will take good care of Primm, don't you worry.",
     "emotion": "neutral",
     "intensity": 50
    },
    {
     "text": "{Sheriff of Primm} I can do right by this town, they were in need of some frontier justice.",
     "emotion": "neutral",
     "intensity": 50
    },
    {
     "text": "{Prison under attack} Sounds like the NCR is finally getting off their ass to settle things around here. Don't expect me to get in their way.",
     "emotion": "neutral",
     "intensity": 50
    },
    {
     "text": "{Player is in Combat} Maybe you ought to worry about the guys trying to kill you first.",
     "emotion": "neutral",
     "intensity": 50
    },
    {
     "text": "Didn't know anyone would willingly walk into this place, not unless they were looking for trouble. What's your story?",
     "emotion": "neutral",
     "intensity": 50
    },
    {
     "text": "Need to talk about something?",
     "emotion": "neutral",
     "intensity": 50
    }
   ],
   "topic": "GREETING",
   "prompt": "GREETING"
  },
  {
   "key": "vfreeformncrcfncrcfmeyerstopic000",
   "section": "topics",
   "responses": [
    {
     "text": "I was a sheriff, believe it or not, for a small town far to the west of here.",
     "emotion": "neutral",
     "intensity": 50
    },
    {
     "text": "The short version is that sometimes justice is a little slow, and I helped speed it up one too many times.",
     "emotion": "neutral",
     "intensity": 50
    },
    {
     "text": "I'm not sorry for anything I did, but I will do the time. Fair enough trade, if you ask me.",
     "emotion": "neutral",
     "intensity": 50
    }
   ],
   "topic": "VFreeformNCRCFNCRCFMeyersTopic000",
   "prompt": "What did you do before you ended up incarcerated?"
  },
  {
   "key": "vfreeformncrcfncrcfmeyerstopic001",
   "section": "topics",
   "responses": [
    {
     "text": "I understand that Cooke was behind it all. I kept my head down the whole time. Didn't want any part of it.",
     "emotion": "neutral",
     "intensity": 50
    },
    {
     "text": "I stuck around, figuring the NCR would show up and put things back the way they were. No sense in making myself look guilty, right?",
     "emotion": "neutral",
     "intensity": 50
    }
   ],
   "topic": "VFreeformNCRCFNCRCFMeyersTopic001",
   "prompt": "Tell me more about what happened in the prison."
  },
  {
   "key": "vfreeformncrcfncrcfmeyerstopic002",
   "section": "topics",
   "responses": [
    {
     "text": "Watch yourself out there.",
     "emotion": "neutral",
     "intensity": 50
    }
   ],
   "topic": "VFreeformNCRCFNCRCFMeyersTopic002",
   "prompt": "Goodbye."
  },
  {
   "key": "vfreeformncrcfncrcfmeyerstopic003",
   "section": "topics",
   "responses": [
    {
     "text": "Some kind of anti-NCR rebel. Some people just don't like being pushed around and told what to do.",
     "emotion": "neutral",
     "intensity": 50
    }
   ],
   "topic": "VFreeformNCRCFNCRCFMeyersTopic003",
   "prompt": "Who's Cooke?"
  },
  {
   "key": "vfreeformncrcfncrcfmeyerstopic004",
   "section": "topics",
   "responses": [
    {
     "text": "He went north with some of the other guys. Didn't say where, didn't say why. All I know is he's got some kind of score to settle with the NCR.",
     "emotion": "neutral",
     "intensity": 50
    }
   ],
   "topic": "VFreeformNCRCFNCRCFMeyersTopic004",
   "prompt": "Where can I find Cooke?"
  },
  {
   "key": "vfreeformncrcfncrcfmeyerstopic005",
   "section": "topics",
   "responses": [
    {
     "text": "I'm not quite sure the kind of greeting NCR troopers will give an escaped con like myself. Figure it's better to stay put for now.",
     "emotion": "neutral",
     "intensity": 50
    }
   ],
   "topic": "VFreeformNCRCFNCRCFMeyersTopic005",
   "prompt": "Why are you still here?"
  },
  {
   "key": "vfreeformncrcfncrcfmeyerstopic006",
   "section": "topics",
   "responses": [
    {
     "text": "Right now, Eddie and his boys run the place. They've got the guns and the dynamite, so they call the shots.",
     "emotion": "neutral",
     "intensity": 50
    }
   ],
   "topic": "VFreeformNCRCFNCRCFMeyersTopic006",
   "prompt": "Who's in charge of the Powder Gangers?"
  },
  {
   "key": "vfreeformncrcfncrcfmeyerstopic007",
   "section": "topics",
   "responses": [
    {
     "text": "Assuming an NCR pardon comes with the job - and it had better - I'll also need to be able to do things my own way.",
     "emotion": "neutral",
     "intensity": 50
    },
    {
     "text": "Due process has its place, but sometimes it's just a waste of time. I'll need to know that I'm not going to end up right back in prison.",
     "emotion": "neutral",
     "intensity": 50
    },
    {
     "text": "My terms are the same. A pardon from the NCR and the freedom to do the job anyway I see fit.",
     "emotion": "neutral",
     "intensity": 50
    }
   ],
   "topic": "VFreeformNCRCFNCRCFMeyersTopic007",
   "prompt": "How would you feel about becoming Primm's new sheriff?"
  },
  {
   "key": "vfreeformncrcfncrcfmeyerstopic008",
   "section": "topics",
   "responses": [
    {
     "text": "All right, then. Guess I'll just make a quiet exit - no need for a goodbye party or anything.",
     "emotion": "neutral",
     "intensity": 50
    }
   ],
   "topic": "VFreeformNCRCFNCRCFMeyersTopic008",
   "prompt": "You have a deal."
  },
  {
   "key": "vfreeformncrcfncrcfmeyerstopic009",
   "section": "topics",
   "responses": [
    {
     "text": "Understood.",
     "emotion": "neutral",
     "intensity": 50
    }
   ],
   "topic": "VFreeformNCRCFNCRCFMeyersTopic009",
   "prompt": "I'll need to think about it."
  },
  {
   "key": "vfreeformncrcfncrcfmeyerstopic010",
   "section": "topics",
   "responses": [
    {
     "text": "When I need to, yes.",
     "emotion": "neutral",
     "intensity": 50
    }
   ],
   "topic": "VFreeformNCRCFNCRCFMeyersTopic010",
   "prompt": "Does that mean you'll take the law into your own hands?"
  },
  {
   "key": "vfreeformncrcfncrcfmeyerstopic015",
   "section": "topics",
   "responses": [
    {
     "text": "There is a NCR camp down on the southern border of Nevada. Camp Mojave I think, try to find someone of authority there.",
     "emotion": "neutral",
     "intensity": 50
    }
   ],
   "topic": "VFreeformNCRCFNCRCFMeyersTopic015",
   "prompt": "Where should I go to get you a pardon?"
  },
  {
   "key": "vfreeformncrcfncrcfmeyerstopic016",
   "section": "topics",
   "responses": [
    {
     "text": "Okay, hurry back. I don't want anyone to start shooting at me.",
     "emotion": "neutral",
     "intensity": 50
    }
   ],
   "topic": "VFreeformNCRCFNCRCFMeyersTopic016",
   "prompt": "I'll let you know when I do."
  },
  {
   "key": "vfreeformncrcfncrcfmeyerstopic017",
   "section": "topics",
   "responses": [
    {
     "text": "Alright, ask away.",
     "emotion": "neutral",
     "intensity": 50
    }
   ],
   "topic": "VFreeformNCRCFNCRCFMeyersTopic017",
   "prompt": "Not yet, but let me ask you about something else first."
  },
  {
   "key": "goodbye",
   "section": "conversation",
   "responses": [
    {
     "text": "Watch yourself out there.",
     "emotion": "neutral",
     "intensity": 50
    }
   ],
   "topic": "GOODBYE",
   "prompt": "Goodbye."
  },
  {
   "key": "ncrcfmeyersdeputyspeech",
   "section": "conversation",
   "responses": [
    {
     "text": "Okay, folks. I called you out here because I've grown to trust you. Primm, the town to the south, is looking for some new law.",
     "emotion": "neutral",
     "intensity": 50
    },
    {
     "text": "I know that you guys don't have experience with law enforcement{pause} at least not on the enforcement side.",
     "emotion": "neutral",
     "intensity": 50
    },
    {
     "text": "However I also know that you are honorable and looking for some redemption. This is our chance for redemption.",
     "emotion": "neutral",
     "intensity": 50
    },
    {
     "text": "Now let's head down there and bring them some law!",
     "emotion": "neutral",
     "intensity": 50
    }
   ],
   "topic": "NCRCFMeyersDeputySpeech",
   "prompt": "NCRCFMeyersDeputySpeech"
  },
  {
   "key": "rnvnewsstory2",
   "section": "other",
   "responses": [
    {
     "text": "{Meyers:} Howdy do, folks. I'm Sheriff Meyers. Be good, or I'll shoot you dead.",
     "emotion": "neutral",
     "intensity": 50
    }
   ],
   "topic": "RNVNewsStory2",
   "prompt": "RNVNewsStoryLine2"
  }
 ],
 "speaker": "meyers"
}
