{
 "id": "sshqmrhandybottlingstandstill",
 "speaker_name": "Mister Handy (Fallout: New Vegas)#Bottling robot",
 "source": "SSHQMrHandyBottlingStandstill.txt",
 "topics": [
  {
   "key": "greeting",
   "section": "topics",
   "responses": [
    {
     "text": "Worker #27438 reporting! There seems to be a malfunction with the line, sir!",
     "emotion": "neutral",
     "intensity": 50
    },
    {
     "text": "Wait a minute. You're not my manager! Intruder!",
     "emotion": "neutral",
     "intensity": 50
    }
   ],
   "topic": "GREETING",
   "prompt": "GREETING"
  }
 ]
}
