{
 "id": "1erefugee",
 "speaker_name": "Refugee (Fallout: New Vegas)",
 "source": "1ERefugee.txt",
 "topics": [
  {
   "key": "greeting",
   "section": "topics",
   "responses": [
    {
     "text": "I never should have left California.",
     "emotion": "neutral",
     "intensity": 50
    },
    {
     "text": "They never told us how expensive it was to get onto the Strip!",
     "emotion": "neutral",
     "intensity": 50
    },
    {
     "text": "You lose all your money too?",
     "emotion": "neutral",
     "intensity": 50
    },
    {
     "text": "That son of a bitch Keith cheated me! I know he did!",
     "emotion": "neutral",
     "intensity": 50
    }
   ],
   "topic": "GREETING",
   "prompt": "GREETING"
  }
 ],
 "speaker": "refugee"
}
