{
 "id": "vmakathleen",
 "speaker_name": "Kate (Fallout: New Vegas)",
 "source": "VMAKathleen.txt",
 "topics": [
  {
   "key": "greeting",
   "section": "topics",
   "responses": [
    {
     "text": "Hi, what can I do for you?",
     "emotion": "neutral",
     "intensity": 50
    },
    {
     "text": "Welcome back. Need anything?",
     "emotion": "neutral",
     "intensity": 50
    },
    {
     "text": "{Sad about her mentor's death} I've been taking care of the shop, since Michael... {Steeled Resolve} I've got to look forward. Someone's got to bring beauty into this barren world.",
     "emotion": "neutral",
     "intensity": 50
    },
    {
     "text": "Hey, it's you! Michael Angelo told me about your photographs. I hope to see the world, one day, like you do.",
     "emotion": "neutral",
     "intensity": 50
    },
    {
     "text": "Welcome back, friend. What can I do for you?",
     "emotion": "neutral",
     "intensity": 50
    }
   ],
   "topic": "GREETING",
   "prompt": "GREETING"
  },
  {
   "key": "vms22vmakathleentopic000",
   "section": "topics",
   "responses": [
    {
     "text": "You saw our front sign, didn't you? This is where all the beautiful signs of the Strip become a reality.",
     "emotion": "neutral",
     "intensity": 50
    },
    {
     "text": "It all comes from Michael Angelo's imagination. We do a little work here and there too, sure, but he's the real artist.",
     "emotion": "happy",
     "intensity": 50
    },
    {
     "text": "You saw our front sign, didn't you? This is where all the beautiful signs of the Strip become a reality.",
     "emotion": "neutral",
     "intensity": 50
    }
   ],
   "topic": "VMS22VMAKathleenTopic000",
   "prompt": "What's this place?"
  },
  {
   "key": "vms22vmakathleentopic001",
   "section": "topics",
   "responses": [
    {
     "text": "Check out the back of the shop, he's usually working there.",
     "emotion": "neutral",
     "intensity": 50
    }
   ],
   "topic": "VMS22VMAKathleenTopic001",
   "prompt": "I'm looking for Michael Angelo."
  },
  {
   "key": "vms22vmakathleentopic002",
   "section": "topics",
   "responses": [
    {
     "text": "Bye.",
     "emotion": "neutral",
     "intensity": 50
    }
   ],
   "topic": "VMS22VMAKathleenTopic002",
   "prompt": "Goodbye."
  },
  {
   "key": "vms22vmakathleentopic003",
   "section": "topics",
   "responses": [
    {
     "text": "He's the reason the Strip shines like a star at night. Mike's imagined and built every sign, billboard and light you'll see around here.",
     "emotion": "happy",
     "intensity": 30
    }
   ],
   "topic": "VMS22VMAKathleenTopic003",
   "prompt": "Who is Michael Angelo?"
  },
  {
   "key": "vms22vmakathleentopic005",
   "section": "topics",
   "responses": [
    {
     "text": "I've been here over a year now. Though I'm not one to get tied for long.",
     "emotion": "happy",
     "intensity": 50
    },
    {
     "text": "I plan to roam the Wasteland once I'm ready. The people need light and kindness, there's too much fear and pain out there already.",
     "emotion": "anger",
     "intensity": 20
    }
   ],
   "topic": "VMS22VMAKathleenTopic005",
   "prompt": "How long have you worked here?"
  },
  {
   "key": "vms22vmakathleentopic007",
   "section": "topics",
   "responses": [
    {
     "text": "He's the reason the Strip shines like a star at night. Mike's imagined and built every sign, billboard and light you'll see around here.",
     "emotion": "sad",
     "intensity": 30
    }
   ],
   "topic": "VMS22VMAKathleenTopic007",
   "prompt": "Tell me again about Michael Angelo."
  }
 ],
 "speaker": "kate"
}
