{
 "id": "vdialoguewestsidegeneric",
 "speaker_name": "VDialogueWestsideGeneric",
 "source": "VDialogueWestsideGeneric.txt",
 "topics": [
  {
   "key": "greeting",
   "section": "topics",
   "responses": [
    {
     "text": "Watch out for Fiends.",
     "emotion": "neutral",
     "intensity": 50
    },
    {
     "text": "We don't need the NCR.",
     "emotion": "neutral",
     "intensity": 50
    },
    {
     "text": "I kinda like being a farmer.",
     "emotion": "happy",
     "intensity": 5
    },
    {
     "text": "I'm glad Mean Sonofabitch is on our side.",
     "emotion": "neutral",
     "intensity": 50
    },
    {
     "text": "{No more water from NCR}Crops aren't getting as much water lately.",
     "emotion": "neutral",
     "intensity": 50
    },
    {
     "text": "{Saint James and Dermot dead}We're better off with those slaver bastards Saint James and Dermot.",
     "emotion": "neutral",
     "intensity": 50
    },
    {
     "text": "That Sweetie sure is something.",
     "emotion": "neutral",
     "intensity": 50
    },
    {
     "text": "{Anderson dead or gone}I'm gonna miss having Anderson around.",
     "emotion": "sad",
     "intensity": 50
    },
    {
     "text": "Anything new happening?",
     "emotion": "neutral",
     "intensity": 50
    }
   ],
   "topic": "GREETING",
   "prompt": "GREETING"
  }
 ]
}
