{
 "id": "188ncrmerchant",
 "speaker_name": "Arms merchant",
 "source": "188NCRMerchant.txt",
 "topics": [
  {
   "key": "greeting",
   "section": "topics",
   "responses": [
    {
     "text": "You a merc? 'Cause you don't look like a prospector...",
     "emotion": "anger",
     "intensity": 50
    },
    {
     "text": "I've still got guns and ammo, if you need them.",
     "emotion": "happy",
     "intensity": 50
    }
   ],
   "topic": "GREETING",
   "prompt": "GREETING"
  },
  {
   "key": "vfreeform188188ncrmerchanttopic000",
   "section": "topics",
   "responses": [
    {
     "text": "Hell, yes sir. Well... not officially. Not anymore. {Emphasis on \"officially.\"}",
     "emotion": "neutral",
     "intensity": 50
    },
    {
     "text": "They mustered me out a year ago. Administrative discharge.",
     "emotion": "neutral",
     "intensity": 50
    },
    {
     "text": "Hell, yes ma'am. Well... not officially. Not anymore. {Emphasis on \"officially.\"}",
     "emotion": "neutral",
     "intensity": 50
    },
    {
     "text": "They mustered me out a year ago. Administrative discharge.",
     "emotion": "neutral",
     "intensity": 50
    }
   ],
   "topic": "VFreeform188188NCRMerchantTopic000",
   "prompt": "Something like that. Are you an NCR soldier?"
  },
  {
   "key": "vfreeform188188ncrmerchanttopic001",
   "section": "topics",
   "responses": [
    {
     "text": "Sure do. Lots of folk been coming out east, sorting through junk, looking for whatever they can sell.",
     "emotion": "neutral",
     "intensity": 50
    },
    {
     "text": "Times are tough back home. Too many people, not enough work. Unless you like shoveling brahmin shit.",
     "emotion": "neutral",
     "intensity": 50
    }
   ],
   "topic": "VFreeform188188NCRMerchantTopic001",
   "prompt": "You do a lot of business with prospectors?"
  },
  {
   "key": "vfreeform188188ncrmerchanttopic003",
   "section": "topics",
   "responses": [
    {
     "text": "It means my C.O. was an asshole, and I told him to eat shit. He ordered me to flog a couple \"deserters.\"",
     "emotion": "neutral",
     "intensity": 50
    },
    {
     "text": "Those kids didn't desert. They just got liquored up on the Strip and missed roll call.",
     "emotion": "neutral",
     "intensity": 50
    },
    {
     "text": "I don't know what else the brass expects... half these kids don't get more than two weeks of training before they ship 'em out here.",
     "emotion": "neutral",
     "intensity": 50
    }
   ],
   "topic": "VFreeform188188NCRMerchantTopic003",
   "prompt": "Administrative discharge? What does that mean?"
  },
  {
   "key": "vfreeform188188ncrmerchanttopic004",
   "section": "topics",
   "responses": [
    {
     "text": "Staff sergeant, Third Platoon, Bravo Company. I was at the Dam when the Legion hit us, three years back. {Proud of her service}",
     "emotion": "neutral",
     "intensity": 50
    },
    {
     "text": "That was a shitstorm, and don't let anybody tell you different. The brass try to play it down, but most of them were back at McCarran.",
     "emotion": "neutral",
     "intensity": 50
    }
   ],
   "topic": "VFreeform188188NCRMerchantTopic004",
   "prompt": "What was your rank?"
  },
  {
   "key": "vfreeform188188ncrmerchanttopic005",
   "section": "topics",
   "responses": [
    {
     "text": "Going home didn't feel right, not with those savages camped on the other side of the river, sharpening their knives.",
     "emotion": "neutral",
     "intensity": 50
    },
    {
     "text": "And I still get to see my old platoon when they pass through here... make sure the new C.O. is treating them right, and sneak them extra ammo.",
     "emotion": "neutral",
     "intensity": 50
    },
    {
     "text": "Anyway, I was always complaining about the standard issue gear. The new kids don't even get body armor, can you believe that?",
     "emotion": "neutral",
     "intensity": 50
    }
   ],
   "topic": "VFreeform188188NCRMerchantTopic005",
   "prompt": "How did you end up selling weapons?"
  },
  {
   "key": "vfreeform188188ncrmerchanttopic006",
   "section": "topics",
   "responses": [
    {
     "text": "Vegas is bleeding us dry. We're tossing caps at a hundred different problems, while Caesar bides his time and lets us wear ourselves out.",
     "emotion": "neutral",
     "intensity": 50
    },
    {
     "text": "This war is gonna bankrupt the NCR, unless we finish off the Legion fast and dirty. {Emphasis on \"fast\" and \"dirty\"}",
     "emotion": "neutral",
     "intensity": 50
    },
    {
     "text": "We shouldn't be perched up at the Dam - we ought to be crossing the Colorado and sticking a boot up Caesar's ass.",
     "emotion": "neutral",
     "intensity": 50
    }
   ],
   "topic": "VFreeform188188NCRMerchantTopic006",
   "prompt": "NCR doesn't have the caps to outfit their troops?"
  },
  {
   "key": "vfreeform188188ncrmerchanttopic007",
   "section": "topics",
   "responses": [
    {
     "text": "So I hooked up with a couple other vets... bribed a Gun Runner...",
     "emotion": "neutral",
     "intensity": 50
    },
    {
     "text": "Now we're supplying grunts, mercs, and anybody else on our side. We don't make much... but at least we're saving lives.",
     "emotion": "neutral",
     "intensity": 50
    }
   ],
   "topic": "VFreeform188188NCRMerchantTopic007",
   "prompt": "Go on."
  },
  {
   "key": "vfreeform188188ncrmerchanttopic013",
   "section": "topics",
   "responses": [
    {
     "text": "I'll be here a while yet, if you need any guns or ammo.",
     "emotion": "neutral",
     "intensity": 50
    }
   ],
   "topic": "VFreeform188188NCRMerchantTopic013",
   "prompt": "Goodbye."
  },
  {
   "key": "vfreeform188188ncrmerchanttopic014",
   "section": "topics",
   "responses": [
    {
     "text": "I didn't. My C.O. ordered me to flog a couple \"deserters,\" and I told him to eat shit. So they kicked me out for insubordination.",
     "emotion": "neutral",
     "intensity": 50
    },
    {
     "text": "Those kids didn't desert. They just got liquored up on the Strip and missed roll call.",
     "emotion": "neutral",
     "intensity": 50
    },
    {
     "text": "I don't know what else the brass expects... half these kids don't get more than two weeks of training before they ship 'em out here.",
     "emotion": "neutral",
     "intensity": 50
    }
   ],
   "topic": "VFreeform188188NCRMerchantTopic014",
   "prompt": "Why did you leave the army?"
  },
  {
   "key": "vfreeform188188ncrmerchanttopic015",
   "section": "topics",
   "responses": [
    {
     "text": "Sure, no problem.",
     "emotion": "neutral",
     "intensity": 50
    }
   ],
   "topic": "VFreeform188188NCRMerchantTopic015",
   "prompt": "Show me what you have for sale."
  }
 ],
 "speaker": "arms_merchant"
}
