{
 "id": "vforttroopercrucified",
 "speaker_name": "crucified trooper",
 "source": "VFortTrooperCrucified.txt",
 "topics": [
  {
   "key": "greeting",
   "section": "topics",
   "responses": [
    {
     "text": "{agonized sobbing}Mercy...",
     "emotion": "pained",
     "intensity": 100
    }
   ],
   "topic": "GREETING",
   "prompt": "GREETING"
  }
 ],
 "speaker": "crucified_trooper"
}
