{
 "id": "vfssilverrushnormalcustomer",
 "speaker_name": "Gambler (Fallout: New Vegas)",
 "source": "VFSSilverRushNormalCustomer.txt",
 "topics": [
  {
   "key": "vms29avfssilverrushnormalcustomertopic000",
   "section": "topics",
   "responses": [
    {
     "text": "Thanks a bunch.",
     "emotion": "neutral",
     "intensity": 50
    }
   ],
   "topic": "VMS29aVFSSilverRushNormalCustomerTopic000",
   "prompt": "Go on in."
  },
  {
   "key": "vms29avfssilverrushnormalcustomertopic001",
   "section": "topics",
   "responses": [
    {
     "text": "Fine by me.",
     "emotion": "neutral",
     "intensity": 50
    }
   ],
   "topic": "VMS29aVFSSilverRushNormalCustomerTopic001",
   "prompt": "We're going to have to search you first."
  },
  {
   "key": "vms29avfssilverrushnormalcustomertopic002",
   "section": "topics",
   "responses": [
    {
     "text": "No... Should I be?",
     "emotion": "neutral",
     "intensity": 50
    }
   ],
   "topic": "VMS29aVFSSilverRushNormalCustomerTopic002",
   "prompt": "Are you drunk?"
  },
  {
   "key": "vms29avfssilverrushnormalcustomertopic005",
   "section": "topics",
   "responses": [
    {
     "text": "Because I'm not! Can't you just tell? Oh, forget it. I'll just head over to that pawn shop by the east gate.",
     "emotion": "neutral",
     "intensity": 50
    }
   ],
   "topic": "VMS29aVFSSilverRushNormalCustomerTopic005",
   "prompt": "How do I know you're not drunk?"
  }
 ],
 "speaker": "gambler"
}
